{
  "machine_id": "m1",
  "session_id": "0199-abc",
  "provider": "codex",
  "seq": 6,
  "ts": "2026-10-07T12:00:01Z",
  "role": "user",
  "text": "Hello.",
  "tool_name": null,
  "model": null,
  "tokens": {
    "input": 0,
    "output": 0,
    "cache": 0
  },
  "raw": [
    1,
    "two",
    null
  ]
}
